{
    "nombre": "CIArte – El Laberinto",
    "whatsapp": "3874535157",
    "direccion": "Ruta Nacional 11, a Campo Santo Entre Laprida, Entre Ríos y, A4430 Gral. Güemes, Salta",
    "email": "contacto@ciarte.com.ar",
    "facebook": "https://facebook.com/ellaberintoteatro",
    "instagram": "https://instagram.com/ciarte_guemes"
}